{
  "registry_version": "1.0.0",
  "feature_gate": "pdf_parity_registry",
  "mutation_pipeline": "OperationIntent -> PatchPlan -> Review/Policy -> Apply -> Verify -> AuditReceipt",
  "support_levels": [
    "stable",
    "beta",
    "preview",
    "plan_only",
    "oracle_only",
    "blocked",
    "documented_limitation"
  ],
  "evidence_classes": [
    "fixture",
    "contract_smoke",
    "schema_validation",
    "visual_regression",
    "differential_oracle",
    "documented_limitation",
    "release_gate"
  ],
  "oracle_requirements": [
    "qpdf",
    "veraPDF",
    "PDFium",
    "Poppler",
    "MuPDF",
    "Ghostscript",
    "Pandoc",
    "LibreOffice"
  ],
  "families": [
    {
      "id": "reading-navigation",
      "title": "Reading and navigation",
      "description": "Open PDFs, inspect them safely, navigate page structure, and keep malformed documents in the safe-open path.",
      "default_support_level": "preview"
    },
    {
      "id": "search-text-extraction",
      "title": "Search and text extraction",
      "description": "Deterministic substring search, reading-order hints, and text extraction evidence.",
      "default_support_level": "preview"
    },
    {
      "id": "rendering-images",
      "title": "Rendering and images",
      "description": "Tile rendering, image XObjects, thumbnailing and visual comparison evidence.",
      "default_support_level": "preview"
    },
    {
      "id": "fonts-color",
      "title": "Fonts and color",
      "description": "Font diagnostics, fallback handling, color fidelity and prepress reporting.",
      "default_support_level": "oracle_only"
    },
    {
      "id": "metadata-preflight",
      "title": "Metadata and preflight",
      "description": "XMP metadata inspection, preflight policy checks and scrub-planning claims.",
      "default_support_level": "preview"
    },
    {
      "id": "annotations-comments",
      "title": "Annotations and comments",
      "description": "Annotation objects, review comments and collaboration sidecars.",
      "default_support_level": "plan_only"
    },
    {
      "id": "forms-active-content",
      "title": "Forms and active content",
      "description": "AcroForms, XFA warnings, JavaScript restrictions and other active-content policy gates.",
      "default_support_level": "plan_only"
    },
    {
      "id": "signatures-encryption-permissions",
      "title": "Signatures, encryption and permissions",
      "description": "Signed-document compatibility, encryption, permission bits and signature-preservation limits.",
      "default_support_level": "documented_limitation"
    },
    {
      "id": "attachments-portfolios-layers-multimedia",
      "title": "Attachments, portfolios, layers and multimedia",
      "description": "Embedded files, portfolios, optional content groups and rich-media limits.",
      "default_support_level": "documented_limitation"
    },
    {
      "id": "tagged-accessibility-standards",
      "title": "Tagged PDFs, accessibility and standards",
      "description": "Tagged structure, reading order, accessibility, PDF/A, PDF/UA, PDF/X and PDF 2.0 claims.",
      "default_support_level": "oracle_only"
    },
    {
      "id": "redaction",
      "title": "Redaction",
      "description": "Sanitizing rewrite, leak verification and redaction receipts.",
      "default_support_level": "preview"
    },
    {
      "id": "page-organization",
      "title": "Page organization",
      "description": "Page insert, delete, reorder, rotate and split/merge planning through the mutation pipeline.",
      "default_support_level": "plan_only"
    },
    {
      "id": "optimization-linearization",
      "title": "Optimization and linearization",
      "description": "Safe optimization, compression, dedupe, linearization and savings receipts.",
      "default_support_level": "oracle_only"
    },
    {
      "id": "repair-incremental-updates",
      "title": "Repair and incremental updates",
      "description": "Safe-open, repair planning, incremental revision handling and recovery receipts.",
      "default_support_level": "preview"
    },
    {
      "id": "ocr-searchable-pdfs",
      "title": "OCR and searchable PDFs",
      "description": "OCR-assisted searchable-PDF workflows and provider-gated extraction.",
      "default_support_level": "documented_limitation"
    },
    {
      "id": "conversion-printing-export",
      "title": "Conversion, printing and export",
      "description": "Source conversion, print/export and adapter-backed output claims.",
      "default_support_level": "plan_only"
    }
  ],
  "claims": [
    {
      "id": "open-basic-pdf",
      "family": "reading-navigation",
      "public_claim": "Open and inspect generated baseline PDFs.",
      "support_level": "preview",
      "evidence": [
        "fixtures/corpus/basic/minimal-v1_0.pdf",
        "fixtures/corpus/basic/minimal-v2_0.pdf",
        "scripts/v8_cli_smoke.sh",
        "scripts/pdf_model_contract_check.py"
      ],
      "oracle_requirements": [
        "qpdf"
      ],
      "fixtures": [
        "fixtures/corpus/basic/minimal-v1_0.pdf",
        "fixtures/corpus/basic/minimal-v2_0.pdf"
      ],
      "limitations": [
        "This is a baseline reader claim, not a guarantee for every PDF class."
      ],
      "requires_mutation_pipeline": false
    },
    {
      "id": "malformed-safe-open",
      "family": "reading-navigation",
      "public_claim": "Treat malformed PDFs as expected input and report parser diagnostics without mutating bytes.",
      "support_level": "preview",
      "evidence": [
        "fixtures/corpus/malformed-adversarial/truncated-catalog.pdf",
        "scripts/pdf_repair_smoke.sh",
        "scripts/pdf_lab_inspect_smoke.sh"
      ],
      "oracle_requirements": [
        "qpdf",
        "veraPDF"
      ],
      "fixtures": [
        "fixtures/corpus/malformed-adversarial/truncated-catalog.pdf"
      ],
      "limitations": [
        "Safe-open is diagnostic-first and does not promise successful repair."
      ],
      "requires_mutation_pipeline": false
    },
    {
      "id": "navigation-outline",
      "family": "reading-navigation",
      "public_claim": "Navigation, outlines and page-jump behavior remain tracked as a governed baseline rather than a marketing promise.",
      "support_level": "documented_limitation",
      "evidence": [
        "docs/native-macos-interaction-model.md",
        "docs/native-macos-handoff-notes.md",
        "docs/native-macos-architecture.md"
      ],
      "oracle_requirements": [],
      "fixtures": [],
      "limitations": [
        "Navigation and outline fidelity remain adapter-owned and may vary by surface."
      ],
      "requires_mutation_pipeline": false
    },
    {
      "id": "text-search",
      "family": "search-text-extraction",
      "public_claim": "Build deterministic text/search evidence for simple generated PDFs.",
      "support_level": "preview",
      "evidence": [
        "fixtures/corpus/basic/text-search-fixture.pdf",
        "fixtures/expected/search/text-search-fixture.search-index.json",
        "scripts/search_index_smoke.sh",
        "scripts/search_compatibility_report.py"
      ],
      "oracle_requirements": [
        "qpdf"
      ],
      "fixtures": [
        "fixtures/corpus/basic/text-search-fixture.pdf"
      ],
      "limitations": [
        "Complex glyph shaping, OCR and missing ToUnicode cases remain documented corpus placeholders."
      ],
      "requires_mutation_pipeline": false
    },
    {
      "id": "text-extraction-geometry",
      "family": "search-text-extraction",
      "public_claim": "Text extraction preserves page geometry, reading order hints and safe diagnostics.",
      "support_level": "preview",
      "evidence": [
        "scripts/pdf_lab_text_map_smoke.sh",
        "scripts/pdf_lab_inspect_smoke.sh",
        "docs/pdf-engineering-lab.md"
      ],
      "oracle_requirements": [
        "qpdf",
        "Poppler"
      ],
      "fixtures": [],
      "limitations": [
        "Geometry and ordering claims remain bounded by corpus fixtures and parser adapters."
      ],
      "requires_mutation_pipeline": false
    },
    {
      "id": "rendering-visual-regression",
      "family": "rendering-images",
      "public_claim": "Run deterministic render smoke and visual regression comparison for the current baseline renderer.",
      "support_level": "preview",
      "evidence": [
        "fixtures/expected/rendered/text-search-fixture/metadata.json",
        "scripts/wave1_render_smoke.sh",
        "scripts/visual_regression_compare.py"
      ],
      "oracle_requirements": [
        "PDFium",
        "Poppler",
        "MuPDF"
      ],
      "fixtures": [
        "fixtures/expected/rendered/text-search-fixture/metadata.json"
      ],
      "limitations": [
        "Production renderer parity must remain a post-launch claim until reference-renderer oracle results are accepted."
      ],
      "requires_mutation_pipeline": false
    },
    {
      "id": "image-content",
      "family": "rendering-images",
      "public_claim": "Image XObjects and image-heavy PDFs are tracked through the renderer and corpus-governance boundaries.",
      "support_level": "documented_limitation",
      "evidence": [
        "docs/compatibility-corpus-governance.md",
        "docs/pdf-engineering-lab.md"
      ],
      "oracle_requirements": [
        "PDFium",
        "Poppler",
        "MuPDF"
      ],
      "fixtures": [],
      "limitations": [
        "Image fidelity claims need corpus fixtures and renderer comparisons before they become public promises."
      ],
      "requires_mutation_pipeline": false
    },
    {
      "id": "font-diagnostics",
      "family": "fonts-color",
      "public_claim": "Font diagnostics surface missing embeds, substitutions and extraction risks.",
      "support_level": "preview",
      "evidence": [
        "docs/color-prepress-fonts-advanced.md",